{
  "schema": "ledger_page/1",
  "id": "ledger.rustmoor.drop_3",
  "item": "item.rustmoor.ledger_page_drop_3",
  "reveal_layer": 1,
  "title": "No. 9, accounts",
  "text": "Line, tarred: 4 Crowns. Paid.\nLead, 14 lb: borrowed. O.B. not to know.\nCoal: owed.\nBread: owed.\nRent, the quarter: 15 Crowns. Owed.\nThe Counting-House sends a runner every Friday, who apologises. Paid the runner in toffee.\nRent: still owed.\nThe line comes first. The next Tinker can have the rent."
}
