{
 "schema": "ledger_page/1",
 "id": "ledger.rustmoor.fixture_long",
 "item": "item.rustmoor.fixture_ledger_page_1",
 "reveal_layer": 1,
 "title": "brass brass brass brass brass brass brass brass brass brass brass brass brass brass brass brass brass brass brass brass brass brass brass brass brass brass brass brass brass brass",
 "text": "You delved, and the players cheered.\n\nbrass brass brass brass brass brass brass brass brass brass brass brass brass brass brass brass brass brass brass brass brass brass brass brass brass brass brass brass brass brass brass brass brass brass brass brass brass brass brass brass brass brass brass brass brass brass brass brass brass brass brass brass brass brass brass brass brass brass brass brass brass brass brass brass brass brass brass brass brass brass brass brass brass brass brass brass brass brass brass brass brass brass brass brass brass brass brass brass brass brass brass brass brass brass brass brass brass brass brass brass brass brass brass brass brass brass brass brass brass brass brass brass brass brass brass brass brass brass brass brass brass brass brass brass brass brass brass brass brass brass brass brass brass brass brass brass brass brass brass brass brass brass brass brass brass brass brass brass brass brass brass brass brass brass brass brass brass brass brass brass brass brass brass brass brass brass brass brass brass brass brass brass brass brass brass brass brass brass brass brass brass brass brass brass brass brass brass brass brass brass brass brass brass brass brass brass brass brass brass brass brass brass brass brass brass brass brass brass brass brass brass brass brass brass brass brass brass brass brass brass brass brass brass brass brass brass brass brass brass brass brass brass brass brass brass brass brass brass brass brass brass brass brass brass brass brass brass brass brass brass brass brass brass brass brass brass brass brass brass brass brass brass brass brass brass brass brass brass brass brass brass brass brass brass brass brass brass brass brass brass brass brass brass brass brass brass brass brass brass brass brass brass brass brass brass brass brass brass brass brass brass brass brass brass brass brass brass brass brass brass brass brass brass brass brass brass brass brass brass brass brass brass brass brass brass brass brass brass brass brass brass brass brass brass brass brass brass brass brass brass brass brass brass brass brass brass brass brass brass brass brass brass brass brass brass brass brass brass brass brass brass brass brass brass brass brass brass brass brass brass brass brass brass brass brass brass brass brass brass brass brass brass brass brass brass brass brass brass brass brass brass brass brass brass brass brass brass brass brass brass"
}
