{
  "schema": "ledger_page/1",
  "id": "ledger.rustmoor.drop_1",
  "item": "item.rustmoor.ledger_page_drop_1",
  "reveal_layer": 1,
  "title": "Kit for the rim",
  "text": "Tarred line, every fathom marked. Three lengths, spliced.\nLead, 14 lb, cupped and armed with tallow.\nChronometer, Polytechnic stores. Not returned.\nThe ladder down the Lowvents rim, by arrangement with nobody.\nRead at first light, when the steam thins.\nRead twice. Write down the second.\nIf the two disagree, read a third time and buy better line."
}
