{
  "schema": "ledger_page/1",
  "id": "ledger.rustmoor.drop_4",
  "item": "item.rustmoor.ledger_page_drop_4",
  "reveal_layer": 1,
  "title": "A coat at the ladder",
  "text": "A coat at the rim ladder, Tue. and Thu.\nThe same coat at the Polytechnic gate, Fri. Asked the porter what I eat.\nBought twice the bread. Let them puzzle.\nO.B. says I am imagining it. O.B. has taken to locking her door.\nThe columns are not safe in the house.\nMoved them. Somewhere with teeth."
}
