{
  "schema": "ledger_page/1",
  "id": "ledger.rustmoor.drop_2",
  "item": "item.rustmoor.ledger_page_drop_2",
  "reveal_layer": 1,
  "title": "The Gazette, one week",
  "text": "Front page, copied.\nMon. Gauge steady. Reassuring.\nTue. Gauge steady. Reassuring.\nWed. Gauge steady. Most reassuring.\nThu. Gauge steady. Reassuring.\nFri. No reading. A recipe for marrow jam.\nSat. Gauge steady. Reassuring.\nMine, the same week, from the rim: up, up, up, up, up, up.\n\"Most\" is new. Watch for \"most\"."
}
